{"burst_by_temp_bin":{"5to15":{"burst":2,"n":6},"ge15":{"burst":1,"n":7},"lt5":{"burst":5,"n":9},"unknown":{"burst":2,"n":3}},"confusion":{"cold_burst":5,"cold_noburst":4,"unknown_burst":2,"unknown_noburst":1,"warm_burst":3,"warm_noburst":10},"counts":{"by_group":{"insect":{"5to15":{"flagged":2,"unflagged":4},"ge15":{"flagged":1,"unflagged":6},"lt5":{"flagged":9,"unflagged":0},"unknown":{"flagged":2,"unflagged":1}},"mechanical":{"5to15":{"flagged":0,"unflagged":0},"ge15":{"flagged":0,"unflagged":0},"lt5":{"flagged":0,"unflagged":0},"unknown":{"flagged":0,"unflagged":2}}},"by_label":{"Common Virtuoso Katydid":{"5to15":{"flagged":2,"unflagged":4},"ge15":{"flagged":1,"unflagged":6},"lt5":{"flagged":8,"unflagged":0},"unknown":{"flagged":2,"unflagged":1}},"Engine":{"5to15":{"flagged":0,"unflagged":0},"ge15":{"flagged":0,"unflagged":0},"lt5":{"flagged":0,"unflagged":0},"unknown":{"flagged":0,"unflagged":2}},"Slender Meadow Katydid":{"5to15":{"flagged":0,"unflagged":0},"ge15":{"flagged":0,"unflagged":0},"lt5":{"flagged":1,"unflagged":0},"unknown":{"flagged":0,"unflagged":0}}},"flags":{"burst_coincident":10,"cold_insect":9,"mechanical_label":2,"temp_unknown":3},"levels":{"likely":9,"none":13,"suspect":5}},"coverage":{"ambient":{"n":3,"t_max":1793023200,"t_min":1792980000},"ambient_covers_reports":false,"degraded":false,"degraded_reasons":[],"inputs":[{"bytes":1106965,"name":"analysis/birds.jsonl","sha256":"fcb2f99a89077291593fbc5f43bdb6779836532df330d34981eca40950a4ff44"},{"bytes":14829,"name":"analysis/dsp.jsonl","sha256":"f7a9f89c1dde8ae18751f3675ba9475854d44148eae4a2f2214c90a687c4a3f3"},{"bytes":14729,"name":"analysis/dsp.jsonl.1","sha256":"7129863c7f0d44977bc8a692003ccf770e0ae932ab2a1960b37593a1796fabe0"},{"bytes":323,"name":"history/ambient_temp.jsonl","sha256":"fcc75e6208b58e9d3d63f8dbf159d490404863b758b2b438439f4b4ca5eaf81f"}],"reports":{"n_in_window":34,"n_rows":34,"t_max":1793045220,"t_min":1792980120},"skipped_lines":{"ambient":0,"birds":4,"dsp":0},"taxa":{"ok":true},"transients":{"n":275,"t_max":1793045230,"t_min":1792980110},"transients_cover_reports":true},"excluded_hidden_reports":5,"experiment":{"valid":true},"flagged_by_group":{"bird":0,"insect":14,"mechanical":0},"flagged_by_hour":{"by_date":{"2026-10-26":{"flagged":[0,0,9,0,0,0,0,0,2,0,0,0,0,0,1,0,0,0,0,0,2,0,0,0],"unflagged":[0,0,0,0,0,0,0,0,4,0,0,0,0,0,6,0,0,0,0,0,1,0,0,0]}},"transient_rate_by_temp_bin":{"-5to0":{"hours":0,"max_per_hour":null,"median_per_hour":null},"0to5":{"hours":1,"max_per_hour":150,"median_per_hour":150},"5to10":{"hours":0,"max_per_hour":null,"median_per_hour":null},"ge10":{"hours":2,"max_per_hour":50,"median_per_hour":37.5},"lt-5":{"hours":0,"max_per_hour":null,"median_per_hour":null}},"utc_hour":{"flagged":[0,0,9,0,0,0,0,0,2,0,0,0,0,0,1,0,0,0,0,0,2,0,0,0],"unflagged":[0,0,0,0,0,0,0,0,4,0,0,0,0,0,6,0,0,0,0,0,1,0,0,0]}},"floor_sweep":{"12":{"by_bin":{"5to15":{"any":6,"cold":6,"n":6},"ge15":{"any":1,"cold":0,"n":7},"lt5":{"any":9,"cold":9,"n":9},"unknown":{"any":0,"cold":0,"n":0}},"by_species":{"Common Virtuoso Katydid":{"5to15":{"any":6,"cold":6,"n":6},"ge15":{"any":1,"cold":0,"n":7},"lt5":{"any":8,"cold":8,"n":8},"unknown":{"any":0,"cold":0,"n":0}},"Slender Meadow Katydid":{"5to15":{"any":0,"cold":0,"n":0},"ge15":{"any":0,"cold":0,"n":0},"lt5":{"any":1,"cold":1,"n":1},"unknown":{"any":0,"cold":0,"n":0}}}},"3":{"by_bin":{"5to15":{"any":2,"cold":0,"n":6},"ge15":{"any":1,"cold":0,"n":7},"lt5":{"any":9,"cold":9,"n":9},"unknown":{"any":0,"cold":0,"n":0}},"by_species":{"Common Virtuoso Katydid":{"5to15":{"any":2,"cold":0,"n":6},"ge15":{"any":1,"cold":0,"n":7},"lt5":{"any":8,"cold":8,"n":8},"unknown":{"any":0,"cold":0,"n":0}},"Slender Meadow Katydid":{"5to15":{"any":0,"cold":0,"n":0},"ge15":{"any":0,"cold":0,"n":0},"lt5":{"any":1,"cold":1,"n":1},"unknown":{"any":0,"cold":0,"n":0}}}},"5":{"by_bin":{"5to15":{"any":2,"cold":0,"n":6},"ge15":{"any":1,"cold":0,"n":7},"lt5":{"any":9,"cold":9,"n":9},"unknown":{"any":0,"cold":0,"n":0}},"by_species":{"Common Virtuoso Katydid":{"5to15":{"any":2,"cold":0,"n":6},"ge15":{"any":1,"cold":0,"n":7},"lt5":{"any":8,"cold":8,"n":8},"unknown":{"any":0,"cold":0,"n":0}},"Slender Meadow Katydid":{"5to15":{"any":0,"cold":0,"n":0},"ge15":{"any":0,"cold":0,"n":0},"lt5":{"any":1,"cold":1,"n":1},"unknown":{"any":0,"cold":0,"n":0}}}}},"k":"artifact_replay","out_of_scope_counts":{"Red-bellied Woodpecker":4,"White-breasted Nuthatch":3},"params":{"burst_max_spread_db":3.0,"burst_min_transients":20,"floor_c":5.0,"since":0,"sweep_c":[3.0,5.0,12.0],"until":null,"window_s":30.0},"transient_hours":[{"n":150,"t_hour_utc":1792980000,"temp_c":2.0},{"n":50,"t_hour_utc":1793001600,"temp_c":10.0},{"n":25,"t_hour_utc":1793023200,"temp_c":20.0},{"n":50,"t_hour_utc":1793044800,"temp_c":null}],"v":1}
